{
  "protocol": "apx",
  "version": "1.0",
  "representation": "apx.graph",
  "profile": ["apx-core/1", "apx-web/1"],
  "kind": "delta",
  "spaceRef": "space:example",
  "targetRef": "target:example",
  "sessionRef": "session:example",
  "observationRef": "observation:example2",
  "baseObservationRef": "observation:example1",
  "documentEpoch": 1,
  "capturedAt": "2026-08-12T00:00:01.000Z",
  "page": {"url": "https://example.test/orders", "title": "Orders", "viewport": {"width": 1280, "height": 720, "scale": 1}, "scroll": {"x": 0, "y": 0}},
  "channels": ["semantic", "interaction"],
  "entities": [{"entityRef": "entity:save", "kind": "ui.control", "semantic": {"role": "button", "name": "Save", "states": {"disabled": true}, "sensitivity": "public"}, "interaction": {"supportedActions": [], "actionable": false, "reasons": ["disabled"]}, "temporal": {"firstSeen": "observation:example1", "lastSeen": "observation:example2", "lastChanged": "observation:example2"}, "provenance": {"semantic": {"mode": "observed", "source": "web.accessibility", "trust": "page"}, "interaction": {"mode": "derived", "source": "pyproc.actionability", "trust": "broker"}}, "locatorRef": "locator:example2"}],
  "relations": [],
  "events": [],
  "delta": {"added": [], "removed": [], "changed": [{"entityRef": "entity:save", "paths": [{"path": "/semantic/states/disabled", "before": false, "after": true}]}]},
  "unresolved": [],
  "completeness": {"semantic": "complete", "interaction": "complete", "visual": "notRequested"},
  "budget": {"maxEntities": 120, "maxRelations": 300, "maxBytes": 65536, "usedBytes": 1689, "truncated": false, "omitted": {"entities": 0, "relations": 0, "visualProbes": 0}},
  "integrity": {"canonicalSha256": "16d24dd99856ecb3a01045f8a78cc062d71af7c3a564ad565ea588bcc50fb790", "graphSha256": "ed8d5ac64f7b0f79f7f9392957bf0db7f8da405832196e5fba44e2ad921505d8"}
}
